{
  "generated_by": "AEROST-OBLIGATION-EXTRACTOR-0.1.0",
  "obligations": [
    {
      "attributes": {
        "case_statement_id": "AIR-STMT-48AD42CC4969",
        "case_value": "INITIALIZING",
        "semantic_event_id": "AIR-STMT-48AD42CC4969::INITIALIZING"
      },
      "description": "Reach CASE arm INITIALIZING of AIR-STMT-48AD42CC4969.",
      "id": "OBL-CASE-AIR-CASEARM-23739F55D41F",
      "kind": "CASE_ARM_REACHED",
      "reachable_status": "UNKNOWN",
      "requirements": [
        "ASCP-REQ-GENERIC-EXECUTION"
      ],
      "subject_ids": [
        "AIR-CASEARM-23739F55D41F",
        "AIR-STMT-48AD42CC4969"
      ]
    },
    {
      "attributes": {
        "case_statement_id": "AIR-STMT-48AD42CC4969",
        "case_value": "DEGRADED",
        "semantic_event_id": "AIR-STMT-48AD42CC4969::DEGRADED"
      },
      "description": "Reach CASE arm DEGRADED of AIR-STMT-48AD42CC4969.",
      "id": "OBL-CASE-AIR-CASEARM-3210100F6FEE",
      "kind": "CASE_ARM_REACHED",
      "reachable_status": "UNKNOWN",
      "requirements": [
        "LINK-HLR-003",
        "LINK-HLR-004",
        "LINK-HLR-006"
      ],
      "subject_ids": [
        "AIR-CASEARM-3210100F6FEE",
        "AIR-STMT-48AD42CC4969"
      ]
    },
    {
      "attributes": {
        "case_statement_id": "AIR-STMT-7FE4FD402DDD",
        "case_value": "LOCKOUT",
        "semantic_event_id": "AIR-STMT-7FE4FD402DDD::LOCKOUT"
      },
      "description": "Reach CASE arm LOCKOUT of AIR-STMT-7FE4FD402DDD.",
      "id": "OBL-CASE-AIR-CASEARM-38926EFE3202",
      "kind": "CASE_ARM_REACHED",
      "reachable_status": "UNKNOWN",
      "requirements": [
        "LINK-HLR-011",
        "LINK-HLR-012"
      ],
      "subject_ids": [
        "AIR-CASEARM-38926EFE3202",
        "AIR-STMT-7FE4FD402DDD"
      ]
    },
    {
      "attributes": {
        "case_statement_id": "AIR-STMT-7FE4FD402DDD",
        "case_value": "LOST_LINK",
        "semantic_event_id": "AIR-STMT-7FE4FD402DDD::LOST_LINK"
      },
      "description": "Reach CASE arm LOST_LINK of AIR-STMT-7FE4FD402DDD.",
      "id": "OBL-CASE-AIR-CASEARM-4DE54E35330D",
      "kind": "CASE_ARM_REACHED",
      "reachable_status": "UNKNOWN",
      "requirements": [
        "LINK-HLR-011",
        "LINK-HLR-012"
      ],
      "subject_ids": [
        "AIR-CASEARM-4DE54E35330D",
        "AIR-STMT-7FE4FD402DDD"
      ]
    },
    {
      "attributes": {
        "case_statement_id": "AIR-STMT-7FE4FD402DDD",
        "case_value": "DEGRADED",
        "semantic_event_id": "AIR-STMT-7FE4FD402DDD::DEGRADED"
      },
      "description": "Reach CASE arm DEGRADED of AIR-STMT-7FE4FD402DDD.",
      "id": "OBL-CASE-AIR-CASEARM-5314E37D9039",
      "kind": "CASE_ARM_REACHED",
      "reachable_status": "UNKNOWN",
      "requirements": [
        "LINK-HLR-011",
        "LINK-HLR-012"
      ],
      "subject_ids": [
        "AIR-CASEARM-5314E37D9039",
        "AIR-STMT-7FE4FD402DDD"
      ]
    },
    {
      "attributes": {
        "case_statement_id": "AIR-STMT-48AD42CC4969",
        "case_value": "LOST_LINK",
        "semantic_event_id": "AIR-STMT-48AD42CC4969::LOST_LINK"
      },
      "description": "Reach CASE arm LOST_LINK of AIR-STMT-48AD42CC4969.",
      "id": "OBL-CASE-AIR-CASEARM-A57D1D16839D",
      "kind": "CASE_ARM_REACHED",
      "reachable_status": "UNKNOWN",
      "requirements": [
        "LINK-HLR-005",
        "LINK-HLR-007",
        "LINK-HLR-014"
      ],
      "subject_ids": [
        "AIR-CASEARM-A57D1D16839D",
        "AIR-STMT-48AD42CC4969"
      ]
    },
    {
      "attributes": {
        "case_statement_id": "AIR-STMT-48AD42CC4969",
        "case_value": "RECOVERY_PENDING",
        "semantic_event_id": "AIR-STMT-48AD42CC4969::RECOVERY_PENDING"
      },
      "description": "Reach CASE arm RECOVERY_PENDING of AIR-STMT-48AD42CC4969.",
      "id": "OBL-CASE-AIR-CASEARM-A6A75BD70C12",
      "kind": "CASE_ARM_REACHED",
      "reachable_status": "UNKNOWN",
      "requirements": [
        "ASCP-REQ-GENERIC-EXECUTION"
      ],
      "subject_ids": [
        "AIR-CASEARM-A6A75BD70C12",
        "AIR-STMT-48AD42CC4969"
      ]
    },
    {
      "attributes": {
        "case_statement_id": "AIR-STMT-7FE4FD402DDD",
        "case_value": "NOMINAL",
        "semantic_event_id": "AIR-STMT-7FE4FD402DDD::NOMINAL"
      },
      "description": "Reach CASE arm NOMINAL of AIR-STMT-7FE4FD402DDD.",
      "id": "OBL-CASE-AIR-CASEARM-AA72EE6244F5",
      "kind": "CASE_ARM_REACHED",
      "reachable_status": "UNKNOWN",
      "requirements": [
        "LINK-HLR-011",
        "LINK-HLR-012"
      ],
      "subject_ids": [
        "AIR-CASEARM-AA72EE6244F5",
        "AIR-STMT-7FE4FD402DDD"
      ]
    },
    {
      "attributes": {
        "case_statement_id": "AIR-STMT-7FE4FD402DDD",
        "case_value": "RECOVERY_PENDING",
        "semantic_event_id": "AIR-STMT-7FE4FD402DDD::RECOVERY_PENDING"
      },
      "description": "Reach CASE arm RECOVERY_PENDING of AIR-STMT-7FE4FD402DDD.",
      "id": "OBL-CASE-AIR-CASEARM-AD5707966716",
      "kind": "CASE_ARM_REACHED",
      "reachable_status": "UNKNOWN",
      "requirements": [
        "LINK-HLR-011",
        "LINK-HLR-012"
      ],
      "subject_ids": [
        "AIR-CASEARM-AD5707966716",
        "AIR-STMT-7FE4FD402DDD"
      ]
    },
    {
      "attributes": {
        "case_statement_id": "AIR-STMT-48AD42CC4969",
        "case_value": "LOCKOUT",
        "semantic_event_id": "AIR-STMT-48AD42CC4969::LOCKOUT"
      },
      "description": "Reach CASE arm LOCKOUT of AIR-STMT-48AD42CC4969.",
      "id": "OBL-CASE-AIR-CASEARM-AF4E32DEF0C2",
      "kind": "CASE_ARM_REACHED",
      "reachable_status": "UNKNOWN",
      "requirements": [
        "ASCP-REQ-GENERIC-EXECUTION"
      ],
      "subject_ids": [
        "AIR-CASEARM-AF4E32DEF0C2",
        "AIR-STMT-48AD42CC4969"
      ]
    },
    {
      "attributes": {
        "case_statement_id": "AIR-STMT-7FE4FD402DDD",
        "case_value": "INITIALIZING",
        "semantic_event_id": "AIR-STMT-7FE4FD402DDD::INITIALIZING"
      },
      "description": "Reach CASE arm INITIALIZING of AIR-STMT-7FE4FD402DDD.",
      "id": "OBL-CASE-AIR-CASEARM-C303ECB4F360",
      "kind": "CASE_ARM_REACHED",
      "reachable_status": "UNKNOWN",
      "requirements": [
        "LINK-HLR-011",
        "LINK-HLR-012"
      ],
      "subject_ids": [
        "AIR-CASEARM-C303ECB4F360",
        "AIR-STMT-7FE4FD402DDD"
      ]
    },
    {
      "attributes": {
        "case_statement_id": "AIR-STMT-48AD42CC4969",
        "case_value": "NOMINAL",
        "semantic_event_id": "AIR-STMT-48AD42CC4969::NOMINAL"
      },
      "description": "Reach CASE arm NOMINAL of AIR-STMT-48AD42CC4969.",
      "id": "OBL-CASE-AIR-CASEARM-CAEFC1E115B8",
      "kind": "CASE_ARM_REACHED",
      "reachable_status": "UNKNOWN",
      "requirements": [
        "LINK-HLR-002",
        "LINK-HLR-006"
      ],
      "subject_ids": [
        "AIR-CASEARM-CAEFC1E115B8",
        "AIR-STMT-48AD42CC4969"
      ]
    },
    {
      "attributes": {
        "required_value": true
      },
      "description": "Observe inhibited normal commit under fault policy AEROST-FAULT-POLICY-698FFF3460AB.",
      "id": "OBL-COMMIT-INHIBITED-AEROST-FAULT-POLICY-698FFF3460AB",
      "kind": "NORMAL_COMMIT_INHIBITED",
      "reachable_status": "UNKNOWN",
      "requirements": [],
      "subject_ids": [
        "AEROST-FAULT-POLICY-698FFF3460AB"
      ]
    },
    {
      "attributes": {
        "decision_id": "AIR-DEC-E8E90B8FBB1D",
        "required_value": false
      },
      "description": "Evaluate atomic condition AIR-COND-01D9F1A011F4 to false in decision AIR-DEC-E8E90B8FBB1D.",
      "id": "OBL-COND-AIR-COND-01D9F1A011F4-FALSE",
      "kind": "CONDITION_FALSE",
      "reachable_status": "UNKNOWN",
      "requirements": [
        "LINK-HLR-008",
        "LINK-HLR-009",
        "LINK-HLR-010"
      ],
      "subject_ids": [
        "AIR-COND-01D9F1A011F4",
        "AIR-DEC-E8E90B8FBB1D"
      ]
    },
    {
      "attributes": {
        "decision_id": "AIR-DEC-E8E90B8FBB1D",
        "required_value": true
      },
      "description": "Evaluate atomic condition AIR-COND-01D9F1A011F4 to true in decision AIR-DEC-E8E90B8FBB1D.",
      "id": "OBL-COND-AIR-COND-01D9F1A011F4-TRUE",
      "kind": "CONDITION_TRUE",
      "reachable_status": "UNKNOWN",
      "requirements": [
        "LINK-HLR-008",
        "LINK-HLR-009",
        "LINK-HLR-010"
      ],
      "subject_ids": [
        "AIR-COND-01D9F1A011F4",
        "AIR-DEC-E8E90B8FBB1D"
      ]
    },
    {
      "attributes": {
        "decision_id": "AIR-DEC-CD85FB02EB72",
        "required_value": false
      },
      "description": "Evaluate atomic condition AIR-COND-057158D99548 to false in decision AIR-DEC-CD85FB02EB72.",
      "id": "OBL-COND-AIR-COND-057158D99548-FALSE",
      "kind": "CONDITION_FALSE",
      "reachable_status": "UNKNOWN",
      "requirements": [
        "LINK-HLR-004",
        "LINK-HLR-006"
      ],
      "subject_ids": [
        "AIR-COND-057158D99548",
        "AIR-DEC-CD85FB02EB72"
      ]
    },
    {
      "attributes": {
        "decision_id": "AIR-DEC-CD85FB02EB72",
        "required_value": true
      },
      "description": "Evaluate atomic condition AIR-COND-057158D99548 to true in decision AIR-DEC-CD85FB02EB72.",
      "id": "OBL-COND-AIR-COND-057158D99548-TRUE",
      "kind": "CONDITION_TRUE",
      "reachable_status": "UNKNOWN",
      "requirements": [
        "LINK-HLR-004",
        "LINK-HLR-006"
      ],
      "subject_ids": [
        "AIR-COND-057158D99548",
        "AIR-DEC-CD85FB02EB72"
      ]
    },
    {
      "attributes": {
        "decision_id": "AIR-DEC-C4B7B27E0075",
        "required_value": false
      },
      "description": "Evaluate atomic condition AIR-COND-07D709DB7F51 to false in decision AIR-DEC-C4B7B27E0075.",
      "id": "OBL-COND-AIR-COND-07D709DB7F51-FALSE",
      "kind": "CONDITION_FALSE",
      "reachable_status": "UNKNOWN",
      "requirements": [
        "LINK-HLR-008",